{
  "schema": "rusty.quest.workflow.evidence_wrapper.v1",
  "intent_sha256": "bbbbbbbbbbbbbbbbbbbbbbbbbbbbbbbbbbbbbbbbbbbbbbbbbbbbbbbbbbbbbbbb",
  "provider": "file-manager-local",
  "provider_contract_schema": "questionable.file_manager.operator_result.v1",
  "provider_evidence_sha256": "cccccccccccccccccccccccccccccccccccccccccccccccccccccccccccccccc",
  "claim": "device-state-confirmed",
  "result": "pass",
  "cleanup": "not-required",
  "artifact_types": [
    "operator-receipt"
  ],
  "limitations": [
    "Application-owned OpenXR and renderer state require a separate app receipt."
  ]
}
